{
  "schema_version": "1.0",
  "topic": "defaults_omitted",
  "title": "Defaults omitted",
  "parts": [
    {
      "id": "a",
      "name": "A",
      "geometry": {
        "type": "cylinder",
        "r_top": 1,
        "r_bottom": 1,
        "height": 1
      },
      "material": {
        "color": "#aabbcc"
      },
      "provenance": {
        "chunk_ids": [
          "golden"
        ]
      }
    },
    {
      "id": "b",
      "name": "B",
      "geometry": {
        "type": "tube",
        "path": [
          [
            0,
            0,
            0
          ],
          [
            1,
            0,
            0
          ]
        ],
        "radius": 0.1
      },
      "material": {
        "color": "#aabbcc"
      },
      "provenance": {
        "chunk_ids": [
          "golden"
        ]
      }
    },
    {
      "id": "c",
      "name": "C",
      "geometry": {
        "type": "lathe",
        "profile": [
          [
            0,
            0
          ],
          [
            1,
            0
          ],
          [
            0,
            1
          ]
        ]
      },
      "material": {
        "color": "#aabbcc"
      },
      "provenance": {
        "chunk_ids": [
          "golden"
        ]
      }
    }
  ]
}
